[
  {
    "memory_id": "mem_repo_schema_rule",
    "type": "repo_rule",
    "gist": "JSON-returning memory harness prompts should explicitly conform to named JSON Schemas.",
    "scope_type": "repo",
    "scope_value": "rktkdduq01/Long-term-memory",
    "confidence": 0.95,
    "importance": 0.92,
    "status": "stable",
    "decay_state": "stable",
    "created_at": "2026-04-20T09:00:00Z",
    "updated_at": "2026-04-23T09:00:00Z",
    "last_confirmed_at": "2026-04-23T09:00:00Z",
    "evidence_refs": [
      {
        "source_type": "repo_config",
        "source_id": "README.md",
        "quote_or_summary": "Use schema-backed JSON for machine-readable steps.",
        "observed_at": "2026-04-23T09:00:00Z",
        "trust_level": "trusted"
      }
    ],
    "derived_from": [
      {
        "source_kind": "candidate",
        "source_id": "cand_repo_schema_rule",
        "relation_type": "promoted_from"
      }
    ],
    "conflicts_with": [],
    "source_trust_level": "trusted",
    "sensitivity": "public",
    "exceptions": [],
    "boundary_conditions": [
      "Applies only to prompts that are meant to return JSON."
    ]
  },
  {
    "memory_id": "mem_user_conservative_briefing",
    "type": "user_preference",
    "gist": "Keep summaries concise and preserve evidence, uncertainty, and conflicts.",
    "scope_type": "global_user",
    "scope_value": "rktkdduq01",
    "confidence": 0.91,
    "importance": 0.87,
    "status": "promoted",
    "decay_state": "stable",
    "created_at": "2026-04-18T09:00:00Z",
    "updated_at": "2026-04-23T09:00:00Z",
    "last_confirmed_at": "2026-04-23T09:00:00Z",
    "evidence_refs": [
      {
        "source_type": "user_message",
        "source_id": "user-turn-2026-04-23-briefing",
        "quote_or_summary": "Keep prompts conservative and machine-readable.",
        "observed_at": "2026-04-23T09:00:00Z",
        "trust_level": "trusted"
      }
    ],
    "derived_from": [
      {
        "source_kind": "candidate",
        "source_id": "cand_user_briefing_pref",
        "relation_type": "promoted_from"
      }
    ],
    "conflicts_with": [],
    "source_trust_level": "trusted",
    "sensitivity": "public",
    "exceptions": [],
    "boundary_conditions": [
      "Task-specific instructions can still override soft preferences."
    ]
  }
]
